Key,Title,include_aparna,include_kyle
WDWYXV4W,Rule extraction from neural network trained using deep belief network and back propagation,1,1
F82SSRUW,Soft granular computing based classification using hybrid fuzzy-KNN-SVM,0,1
GX5IR2BJ,Is Human Walking a Network Medicine Problem? An Analysis Using Symbolic Regression Models with Genetic Programming,0,0
WDGGXRFT,Benchmarking state-of-the-art symbolic regression algorithms,1,0
XWFGXQVI,Integrating a semantic-based retrieval agent into case-based reasoning systems: A case study of an online bookstore,0,1
YNXWV2VC,A soft-sensing method of dissolved oxygen concentration by group genetic case-based reasoning with integrating group decision making,0,0
6D9FGR2F,Regression learning based on incomplete relationships between attributes,0,1
JE7GR44Q,Synthesis of incremental linear algebra programs,0,0
CUIWJLIZ,Time for a change: A tutorial for comparing multiple classifiers through Bayesian analysis,0,0
F3LKUNLQ,Do machine learning methods used in data mining enhance the potential of decision support systems? A review for the urban water sector,0,0
X9FXTBPE,A deep learning based multitask model for network-wide traffic speed prediction,0,0
7ERNIFYV,Optimal experiment design for coevolutionary active learning,0,0
4PMTIAUP,The three-way-in and three-way-out framework to treat and exploit ambiguity in data,0,0
CAANARKB,A neural network-based multi-agent classifier system with a Bayesian formalism for trust measurement,0,0
YLDVGTM3,Fuzzy multilevel graph embedding,0,0
T8Q34594,6G networks: Beyond Shannon towards semantic and goal-oriented communications,1,0
HTQ2HY8F,A context-sensitive offloading system using machine-learning classification algorithms for mobile cloud environment,0,0
SYJ9W3NF,A case-base fuzzification process: diabetes diagnosis case study,0,0
L4HLA26N,Learning and applying adaptation rules for categorical features: An ensemble approach,0,0
WNG5EMUI,Grid Integration of Solar Photovoltaic System Using Machine Learning-Based Virtual Inertia Synthetization in Synchronverter,0,0
HQYD7DXN,Automatic document layout analysis through relational machine learning,0,0
88EIMIB9,Classification of diabetes maculopathy images using data-adaptive neuro-fuzzy inference classifier,0,0
K7BY8PWM,Medical data classification using interval type-2 fuzzy logic system and wavelets,0,0
2KKWBRNS,SNoRe: Scalable Unsupervised Learning of Symbolic Node Representations,0,1
LR3FI9PH,Knowledge graphs,0,0
IN5NTL48,Speeding up inference for probabilistic logic programs,0,0
EPE47P4B,A novel hybrid machine learning approach for change detection in remote sensing images,0,0
5ICD7QYP,Integrated integer programming and decision diagram search tree with an application to the maximum independent set problem,0,0
JWXLTYZ6,A threshold fuzzy entropy based feature selection for medical database classification,0,0
TZB3DZY9,SML-Bench - A benchmarking framework for structured machine learning,0,1
K75C7DPI,Ontology mediation approach using formal concept analysis,0,1
MXE9GU4L,Shadow detection from images using fuzzy logic and PCPerturNet,0,0
ZTURK5EW,Reductive Reasoning Rough and Fuzzy Sets as Frameworks for Reductive Reasoning,0,0
NM743NT3,A fuzzy-ontology-oriented case-based reasoning framework for semantic diabetes diagnosis,0,0
ICX94CMM,Optimal quantum state transformations based on machine learning,0,0
LXSKDGQ2,CMODLB: an efficient load balancing approach in cloud computing environment,0,0
LFL6YQGV,A Decision Tree-Initialised Neuro-fuzzy Approach for Clinical Decision Support,1,0
H3QCZ6XR,Combining deep learning and argumentative reasoning for the analysis of social media textual content using small data sets,0,1
HK9P9MMN,Experimenting with the partnership ability φ-index on a million computer scientists,0,0
4XJIU46N,Extended Belief Rule-Base Optimization Base on Clustering Tree and Parameter Optimization,0,0
3NLTZ2RZ,Roller: a novel approach to Web information extraction,0,1
B7DZ7PSJ,Algorithm for identifying clients based on dynamic MAC addresses in narrowly targeted secure networks using deep learning neural networks,0,0
SESHVYVF,Neural network classifier for automatic course-keeping based on fuzzy logic,0,1
PEG4JVXZ,Crowdsourced reliable labeling of safety-rule violations on images of complex construction scenes for advanced vision-based workplace safety,0,0
9TSJKBGA,Global relational reasoning with spatial temporal graph interaction networks for skeleton-based action recognition,0,0
P7XN5PNI,A study on automatic fixture design using reinforcement learning,0,0
HE8I6226,Interactive relational reinforcement learning of concept semantics,1,0
LLSCAKRI,Knowledge-light adaptation approaches in case-based reasoning for radiotherapy treatment planning,0,0
N7KJGKCE,Library of actions: Implementing a generic robot execution framework by using manipulation action semantics,0,0
3P9VZIGK,Cognitive function synthesis: preliminary results,0,1
TUWJMS6C,A probabilistic argumentation framework for reinforcement learning agents: Towards a mentalistic approach to agent profiles,1,1
CIKGZ948,Structured probabilistic inference,0,0
B3ERYYBZ,Shrinking FPGA Static Power via Machine Learning-Based Power Gating and Enhanced Routing,0,0
F4EY43IL,Fuzzy Kernel Alignment with Application to Attribute Reduction of Heterogeneous Data,0,1
BEZQABKY,Towards a Quantum-Inspired Binary Classifier,0,0
8RN37DQZ,A machine learning system to improve heart failure patient assistance,0,0
RWQPHS8H,An Energy-Efficient Nonvolatile In-Memory Computing Architecture for Extreme Learning Machine by Domain-Wall Nanowire Devices,0,0
HMX329PF,3D Scene interpretation by combining probability theory and logic: The tower of knowledge,0,0
P5Y77D3H,Applying Probabilistic Programming to Affective Computing,1,1
3MYK5YAE,A novel machine learning technique for computer-aided diagnosis,0,0
VDHPWBD4,"Fast, accurate, and transferable many-body interatomic potentials by symbolic regression",1,0
YX2SCA8W,Automatic feature engineering for regression models with machine learning: An evolutionary computation and statistics hybrid,1,1
BSA4TJKU,Learning from heterogeneous temporal data in electronic health records,0,0
FHJCBRPD,An evidential classifier based on Dempster-Shafer theory and deep learning,1,0
GDY8SK4B,Image Segmentation Using Deep Learning: A Survey,0,0
HDTCXJVY,Forensic insights from smartphones through electromagnetic side-channel analysis,0,0
A9KYJTKS,Deep Learning and Dempster-Shafer Theory Based Insider Threat Detection,0,0
UAF9VVZ7,Learning Self-Informed Feature Contribution for Deep Learning-Based Acoustic Modeling,0,0
C4QA6KZT,"Perception, Guidance, and Navigation for Indoor Autonomous Drone Racing Using Deep Learning",0,0
N3IWMVH6,Spatial-Aware Hierarchical Collaborative Deep Learning for POI Recommendation,0,0
UXI3YFZE,MizAR 40 for Mizar 40,0,0
48I88AWX,"Reasoning with unknown, not-applicable and irrelevant meta-values in concept learning and pattern discovery",0,0
7KQW8ICA,"Cognitive Architecture, Holistic Inference and Bayesian Networks",0,1
DJWBTRHZ,An Explainable Machine Learning Model for Early Detection of Parkinson's Disease using LIME on DaTSCAN Imagery,0,0
R3GCF79Y,A study on hepatitis disease diagnosis using multilayer neural network with Levenberg Marquardt training algorithm,0,0
2RKWW4CU,A hybrid model combining case-based reasoning and fuzzy decision tree for medical data classification,0,0
2ASAPCSK,Human experts vs. machines in taxa recognition,0,0
7LHTB7DE,Performance comparison of intrusion detection systems and application of machine learning to Snort system,0,0
DKZCDC5T,Recent advances in the application of computational intelligence techniques in oil and gas reservoir characterisation: A comparative study,0,0
B3YKKZVJ,Decoding emotional changes of android-gamers using a fused Type-2 fuzzy deep neural network,0,0
3KMBVK7P,Interpretable semi-parametric regression models with defined error bounds,0,0
2Z2VPSI3,Fuzzy cognitive map based approach for predicting yield in cotton crop production as a basis for decision support system in precision agriculture application,0,0
PBATN5JV,The Hanabi challenge: A new frontier for AI research,0,0
H7BCABJX,Learning markov logic networks with limited number of labeled training examples,0,0
J5BDQFIM,Parallel online event calculus learning for complex event recognition,0,0
RE66UWH3,Monocular 3D vehicle detection with multi-instance depth and geometry reasoning for autonomous driving,0,0
LMXZ46W9,Multiple-valued computing by dipole-dipole coupled proteins,0,0
SMGRV8YM,A Vector Processor for Mean Field Bayesian Channel Estimation,0,0
B8H3TQZ9,Simultaneous Reconnection Surgery Technique of Routing with Machine Learning-Based Acceleration,0,0
IFRCPZ2Q,Factual and Counterfactual Explanations for Black Box Decision Making,1,1
DGEZSSJB,An analytical method for diseases prediction using machine learning techniques,0,0
87HMS7LA,A Machine Learning Method for Power Prediction on the Mobile Devices,0,0
2JUK2NGV,Approximate computing for Long Short Term Memory (LSTM) neural networks,0,0
7BC6KSYJ,Automatic full conversion of clinical terms into SNOMED CT concepts,0,0
UBYI8X7I,Multimodal and ontology-based fusion approaches of audio and visual processing for violence detection in movies,0,0
MI4QDPFV,Distributed training of support vector machine on a multiple-fpga system,0,0
SQI9GEV7,Efficient On-Chip Randomness Testing Utilizing Machine Learning Techniques,0,0
74QZV8X9,Robust reasoning over heterogeneous textual information for fact verification,0,1
NJFLVCKA,Formalizing biomedical concepts from textual definitions,0,1
SMHUZFII,On the predictive analysis of behavioral massive job data using embedded clustering and deep recurrent neural networks,1,0
6ZFYIRK7,Capturing causality and bias in human action recognition,0,0
9URQK9SB,Segmentation of deformed kidneys and nephroblastoma using Case-Based Reasoning and Convolutional Neural Network,0,1
452MQ7P7,Least squares support vector regression and interval type-2 fuzzy density weight for scene denoising,0,1
QYVF8259,Learning graphical models for relational data via lattice search,0,0
CA82TQD6,Automated identification of protein-ligand interaction features using Inductive Logic Programming: a hexose binding case study,0,0
MS2IJ8C7,Cardiac Phase Detection in Echocardiograms with Densely Gated Recurrent Neural Networks and Global Extrema Loss,0,0
EA7XCDNS,Remote sensing based rain fall prediction using big data assisted integrated routing framework,1,0
9YGPA79Q,A framework for learning comprehensible theories in XML document classification,0,1
4NTJ3CPI,Probabilistic framework for solving visual dialog,0,1
MDRB9QX7,Inference Over Distribution of Posterior Class Probabilities for Reliable Bayesian Classification and Object-Level Perception,0,1
F4IUDQR9,Hammer for Coq: Automation for Dependent Type Theory,0,0
B8H47IUG,Learning grammar rules of building parts from precise models and noisy observations,0,0
J2MLKV49,Evaluating representational systems in artificial intelligence,1,1
QQA8KEZY,Evidential calibration of binary SVM classifiers,0,0
YB9NBAB2,Generating action plans for poultry management using artificial neural networks,0,0
TRMR26MF,DePicT Melanoma Deep-CLASS: A deep convolutional neural networks approach to classify skin lesion images,0,0
V7HN2M8V,Deep Learning Modeling for Top-N Recommendation with Interests Exploring,0,0
63R2FPMC,Evidence reasoning method for constructing conditional probability tables in a Bayesian network of multimorbidity,0,0
U5AE2H6C,Development of engagement evaluation method and learning mechanism in an engagement enhancing rehabilitation system,0,0
ZFZWRJLU,Finding waldo: Learning about users from their interactions,0,0
GUQ353EH,Re-framing the characteristics of concepts and their relation to learning and cognition in artificial agents,0,1
FLTMZA7C,Requirements-Driven Test Generation for Autonomous Vehicles with Machine Learning Components,0,0
V9WYKD3I,A machine learning-based framework for preventing video freezes in HTTP adaptive streaming,0,0
MSXLN29Z,PointFusionNet: Point feature fusion network for 3D point clouds analysis,0,0
D32GU8PR,An attention-based mechanism to combine images and metadata in deep learning models applied to skin cancer classification,0,0
JXBXL4RJ,A combined object detection method with application to pedestrian detection,0,0
URD5RN2Y,A Compressed Sensing Network for Acquiring Human Pressure Information,0,0
KUKEWFVG,Retinal Image Classification by Self-Supervised Fuzzy Clustering Network,0,0
5TXR7CDH,Deep Learning with Long Short-Term Memory for Time Series Prediction,0,0
S6GZFTNC,Dissonance between human and machine understanding,0,0
BED8VGVH,Wombit: A Portfolio Bit-Vector Solver Using Word-Level Propagation,0,1
ZH3BIS2R,Combining NEAT and PSO for learning tactical human behavior,0,0
KHEVR9HV,Weighted Fuzzy Dempster-Shafer Framework for Multimodal Information Integration,0,0
ZB5F8VVF,Models of Parkinson's Disease Patient Gait,0,0
7CRLDQK9,A programmable neural virtual machine based on a fast store-erase learning rule,1,0
HFTHDEN2,An operational semantics for the cognitive architecture ACT-R and its translation to constraint handling rules,0,0
DSBCZLXS,Multi-objective cost-sensitive attribute reduction on data with error ranges,0,0
A59DP9ZJ,Relational machine learning for electronic health record-driven phenotyping,0,1
SBHDPFRP,Techniques to enhance efficiency and effectiveness of inductive logic programming systems: The TWEETY approaches,0,0
MM9TSGYY,Investigation of multi-layer neural network performance evolved by genetic algorithms,0,1
XLND88LE,PVHArray: An Energy-Efficient Reconfigurable Cryptographic Logic Array with Intelligent Mapping,0,0
D94QX9C4,An Adaptive Regularization Approach to Colonoscopic Polyp Detection Using a Cascaded Structure of Encoder–Decoders,0,0
4EF4BXD9,Solving the twitter sentiment analysis problem based on a machine learning-based approach,1,1
44KCPGAV,Semisupervised Learning via Axiomatic Fuzzy Set Theory and SVM,1,1
PD2A2ZVV,"Ontology based E-learning framework: A personalized, adaptive and context aware model",0,1
8S52Z6X6,Rotor fault diagnosis system based on sGA-based individual neural networks,0,0
JTPEVYT2,A privacy-preserving resource trading scheme for Cloud Manufacturing with edge-PLCs in IIoT,0,0
R5DP39JK,Fuzzy rule based unsupervised sentiment analysis from social media posts,1,1
6652HST4,Analysis and characterization of comparison shopping behavior in the mobile handset domain,0,0
JW8RYKZS,"A Survey on Knowledge Graphs: Representation, Acquisition, and Applications",1,0
AGS6YBSZ,Learning deep IA bidirectional intelligence,1,0
ACDMDN8W,A new neutrosophic TF-IDF term weighting for text mining tasks: text classification use case,1,1
DNTBM6ND,Hierarchical Symbol-Based Health-Status Analysis Using Time-Series Data in a Core Router System,0,0
QPIC5NQR,Non-small-cell lung cancer prediction using radiomic features and machine learning methods,0,0
YL2NV4QJ,Cross-Domain Reuse of Extracted Knowledge in Genetic Programming for Image Classification,0,0
MRW6DUQ6,Automatic design of semantic similarity controllers based on fuzzy logics,0,0
BE4WSGRL,Error-Resilient Spintronics via the Shannon- Inspired Model of Computation,0,0
ZAM8XBEB,Automatic discovery of relational concepts by an incremental graph-based representation,0,0
5ERBF464,Automatic prediction of stress in piglets (Sus Scrofa) using infrared skin temperature,0,0
MRPX5C87,Symbolic data analysis to defy low signal-to-noise ratio in microarray data for breast cancer prognosis,0,0
W343HNE7,Visual Content Learning in a Cognitive Vision Platform for Hazard Control (CVP-HC),0,0
PN8G2HTP,Physics-based scene-level reasoning for object pose estimation in clutter,0,0
2FE2GRPE,Two complementary methods for the computational modeling of cleaning processes in food industry,0,0
L5FKAPGN,Using extended siamese networks to provide decision support in aquaculture operations,0,0
JS7C6KIH,"Spectrum Intelligent Radio: Technology, Development, and Future Trends",0,0
F6CE42MS,Binary classification in unstructured space with hypergraph case-based reasoning,0,0
7DRQNQ69,SCBM: soft case base maintenance method based on competence model,0,0
948BANJ5,Semantic video labeling by developmental visual agents,0,0
J5UZZCST,A Semi-Supervised Paraphrase Identification Model Based on Multi-Granularity Interaction Reasoning,1,0
ZPVH4GZ4,Hierarchical Fused Model with Deep Learning and Type-2 Fuzzy Learning for Breast Cancer Diagnosis,0,0
NWG2B2ZI,Intelligent software engineering in the context of agile software development: A systematic literature review,0,0
MGCPJT4Y,Business process verification and restructuring LTL formula based on machine learning approach,0,0
95SRWHND,Anticipatory mobile computing: A survey of the state of the art and research challenges,0,0
7UVV8IEJ,A discretely adaptive connection logic network,0,0
9MZYR2WH,Recent progresses on object detection: a brief review,0,0
4XQVNZV2,Deep Learning Based Advanced Spatiooral Extraction Model in Medical Sports Rehabilitation for Motion Analysis and Data Processing,0,0
TBJ6EUJC,An explainable AI decision-support-system to automate loan underwriting,1,1
2U4V9L7M,An interpretable boosting model to predict side effects of analgesics for osteoarthritis,0,0
8ATUXH3H,Temporal logic learning-based anomaly detection in metroplex terminal airspace operations,0,0
LN3B9I9X,An intelligent flow-based and signature-based IDS for SDNs using ensemble feature selection and a multi-layer machine learning-based classifier,0,0
ESSZJL2U,Exploiting macro-actions and predicting plan length in planning as satisfiability,0,0
G6T5N4DJ,An effective secret image sharing using quantum logic and GPGPU based EDNN super-resolution,0,0
A33EPND6,A Hybrid Service Selection and Composition Model for Cloud-Edge Computing in the Internet of Things,0,0
EQR62SUA,Early anomaly detection in smart home: A causal association rule-based approach,0,0
RWSZRW6S,SVAS: Surveillance Video Analysis System,0,0
9VUI3ZWE,Interpretable neural networks based on continuous-valued logic and multicriteria decision operators,0,1
KKLQLDQG,Pairwise saturations in inductive logic programming,0,0
QVDA2MWU,WoMan: Logic-based workflow learning and management,0,0
2RBV2J46,Targets Classification Based on Multi-sensor Data Fusion and Supervised Learning for Surveillance Application,0,0
DIXVTU9Z,Materializing the promises of cognitive IoT: How cognitive buildings are shaping the way,0,0
BSPHEXCD,Tensor-based relational learning for ontology matching,0,1
CIDIIPGP,Energy-efficient cluster-based unmanned aerial vehicle networks with deep learning-based scene classification model,0,0
R7GRYRYP,Dynamic Service Function Chain Embedding for NFV-Enabled IoT: A Deep Reinforcement Learning Approach,0,0
K2KI8WVH,DECAF: Deep Case-based Policy Inference for knowledge transfer in Reinforcement Learning,0,0
PYM7X9RY,Sentiment-aware volatility forecasting,0,0
3C8EP7K7,Short-term prediction of traffic flow using a binary neural network,1,0
IGP9Z8ZP,Validation of an ontological medical decision support system for patient treatment using a repository of patient data: Insights into the value of machine learning,0,0
QYWG8INU,Modeling IoT Equipment with Graph Neural Networks,0,0
4MLWKT3P,PDE-Net 2.0: Learning PDEs from data with a numeric-symbolic hybrid deep network,0,0
7DXG8V9R,Automated quantification of clinically significant colors in dermoscopy images and its application to skin lesion classification,0,0
EJGV4D23,Active Learning to Understand Infectious Disease Models and Improve Policy Making,0,0
2TWEX8A6,A new fuzzy rule based pixel organization scheme for optimal edge detection and impulse noise removal,0,0
SAYJMQTT,A formal methods approach to interpretable reinforcement learning for robotic planning,0,0
72K6I3AK,Improving test and diagnosis efficiency through ensemble reduction and learning,0,0
8VBYRUUJ,A Spammer Identification Method for Class Imbalanced Weibo Datasets,1,0
4EBT8YAQ,A minimum centre distance rule activation method for extended belief rule-based classification systems,1,0
SPU9STDS,Markov modeling of dynamical systems via clustering and graph minimization,0,0
I8IZECX6,Improving the prediction of material properties of concrete using Kaizen Programming with Simulated Annealing,0,0
QDA52ZBD,Multi-stage mixed rule learning approach for advancing performance of rule-based classification,1,1
L7SY5CHQ,Implemented IoT-based self-learning home management system (SHMS) for Singapore,0,0
XVPC5VNR,Grasping inter-attribute and temporal variability in multivariate time series,0,0
4TEYGEW3,Multi-observable reputation scoring system for flagging suspicious user sessions,0,0
FM84GNCJ,Low-cost Non-contact PCBs Temperature Monitoring and Control in a Hot Air Reflow Process based on Multiple Thermocouples Data Fusion,0,0
HMEIIUQS,A GA-LR wrapper approach for feature selection in network intrusion detection,0,0
8WI3IY7W,Adaptive complex event processing for harmful situation detection,1,0
7KXVGAIK,CIMMEP: constrained integrated method for CBR maintenance based on evidential policies,0,0
CHIBCJTD,An evidential integrated method for maintaining case base and vocabulary containers within CBR systems,0,0
GQ4IILGA,An evidential reasoning-based decision support system for handling customer complaints in mobile telecommunications,0,1
S8Z4DGTN,Tremor assessment using smartphone sensor data and fuzzy reasoning,0,0
63UCY4MH,Simple pattern minimality problems: Integer linear programming formulations and covering-based heuristic solving approaches,0,0
D84YKIEW,A knowledge-based risk management tool for construction projects using case-based reasoning,0,0
STHTFNSV,CAVIAR: Context-driven Active and Incremental Activity Recognition,0,0
J2LCPFWH,Reasoning with probabilistic and deterministic graphical models: Exact Algorithms,1,0
KKVQQ3KI,Evaluating bacterial gene-finding hmm structures as probabilistic logic programs,0,0
RCU8TBWV,An approach towards adaptive service composition in markets of composed services,1,0
WQPZWUPW,Bio-inspired computing tools and applications: position paper,0,0
HZ6UUSVK,Ensemble based technique for the assessment of fetal health using cardiotocograph – a case study with standard feature reduction techniques,0,0
25BNTAG7,Towards semantic-driven high-content image analysis: An operational instantiation for mitosis detection in digital histopathology,0,0
XN6ZFIKC,"Information-theoretic syndrome evaluation, statistical root-cause analysis, and correlation-based feature selection for guiding board-level fault diagnosis",0,0
4N4ETL7N,An interactive human centered data science approach towards crime pattern analysis,0,0
QJ2SS2BK,"Proactive, uncertainty-driven queries management at the edge",0,0
KTEHK4MZ,Deepening the IDA* algorithm for knowledge graph reasoning through neural network architecture,0,1
WURW9YIW,Enhancing a fuzzy logic inference engine through machine learning for a self- Managed network,0,0
RDSQSBN7,Relation Extraction in Dialogues: A Deep Learning Model Based on the Generality and Specialty of Dialogue Text,0,1
WATJLW3E,Efficient neural matrix factorization without sampling for recommendation,0,0
ZWSKQQLU,MemoryPath: A deep reinforcement learning framework for incorporating memory component into knowledge graph reasoning,0,1
CFA6YMU5,The effects of transformative and non-transformative discourse on individual performance in collaborative-inquiry learning,0,0
7SWEDW5Q,"A reinforcement learning based solution for cognitive network cooperation between co-located, heterogeneous wireless sensor networks",0,0
ZPT2RZFB,Predicting Destinations by a Deep Learning based Approach,0,0
XEQSDFKG,Double MAC on a DSP: Boosting the performance of convolutional neural networks on FPGAs,0,0
PPUFZLVI,Fast Monocular Visual Place Recognition for Non-Uniform Vehicle Speed and Varying Lighting Environment,0,0
H8M7JDDK,Using Fuzzy Inference Systems for the Creation of Forex Market Predictive Models,0,0
8CBUEYRZ,Fault diagnosis based on non-negative sparse constrained deep neural networks and dempster-shafer theory,1,0
MAVG55KV,A Hierarchical Fused Fuzzy Deep Neural Network for Data Classification,1,0
KT9B5ZG6,A Blockchained Federated Learning Framework for Cognitive Computing in Industry 4.0 Networks,0,0
R7F7LCMV,Reactive planar non-prehensile manipulation with hybrid model predictive control,0,0
DT25P4XK,Human action performance using deep neuro-fuzzy recurrent attention model,0,0
VUVBSWDH,Semi-supervised online structure learning for composite event recognition,0,0
I8SFIEZV,Relational linear programming,0,0
ASJK25AL,COVID-19 detection using deep learning models to exploit Social Mimic Optimization and structured chest X-ray images using fuzzy color and stacking approaches,0,0
TN98UCVS,Deep Episodic Memory for Verbalization of Robot Experience,0,0
T3GR24YN,NeuralTaint: A Key Segment Marking Tool Based on Neural Network,0,0
2SYLQCKV,Generalizing AI: Challenges and Opportunities for Plug and Play AI Solutions,0,0
UYI9PBJ8,A Generalised Methodology for the Diagnosis of Aircraft Systems,0,0
RJVIQ7K2,Random Forest Based Searching Approach for RDF,0,0
TZXZ98MK,Modeling temporal interactions with interval temporal bayesian networks for complex activity recognition,0,0
QWW2USBQ,Parallel symmetric class expression learning,0,0
KPRGCT38,Learning Distributions of Image Features by Interactive Fuzzy Lattice Reasoning in Pattern Recognition Applications,0,0
5Y564I2L,Logical scalability and efficiency of relational learning algorithms,0,0
IQXK33QM,A multi-agent dynamic system for robust multi-face tracking,0,0
UPCCG6XE,Novel elegant fuzzy genetic algorithms in classification problems,0,0
FA66MGY5,"On performance of case-based reasoning in Chinese business failure prediction from sensitivity, specificity, positive and negative values",0,0
7W6TPBNR,A versatile hardware/software platform for personalized driver assistance based on online sequential extreme learning machines,0,0
